{
 "slug": "about-time",
 "title": "About Time",
 "year": 2013,
 "runtime_min": 123,
 "sub": "Fourteen scenes. The left spine is the order the film screens them; the right spine is when the nights he re-lives really happened.",
 "notes": [
  "Tim's rewinds are local, not a shuffle: the film tells his life straight, and the crossings are the nights he goes back into. Where a ribbon runs flat, the film is running in order.",
  "REPEATED TIME: a night he lives twice gets ONE node on the right spine, at the slot where it happened. New Year's Eve is screened twice (the timid first pass, then the replay he kisses through) and charted once, because the night happened once.",
  "ERASED TIME: the Dans le Noir meeting and the rescue of Harry's play are the same night lived twice. The rewind erases the restaurant and with it Mary's number, but he lived that evening, so it keeps a slot - placed just before the play, which is the order he lived them - and the pair is charted as two nodes because two different things happened in the two versions.",
  "VISITED PAST: the childhood beach day and the last table-tennis visit are placed where they sit in the world's calendar (childhood; just before Dad dies), not where Tim stands when he travels. That is what makes those ribbons cross the whole chart.",
  "Chronology is a judgement: the film gives no chapter cards, so acts are assigned by geography (Cornwall / London / married life) and the exact act lines are arguable.",
  "Everything here is what the film shows. Nothing is invented to make a crossing."
 ],
 "threads": {
  "tim": "Tim",
  "mary": "Mary",
  "dad": "Dad",
  "harry": "Harry",
  "charlotte": "Charlotte",
  "kitkat": "Kit Kat"
 },
 "legend_note": "Node numbering: left spine = screening position, right spine = real order. The gap between the two numbers is the edit.",
 "scenes": [
  {
   "id": "nye",
   "label": "New Year's Eve, the party",
   "chapter": "ACT ONE",
   "as_screened": 1,
   "happened": 2,
   "thread": "tim",
   "mins": 8
  },
  {
   "id": "secret",
   "label": "Dad tells him about the gift",
   "chapter": "ACT ONE",
   "as_screened": 2,
   "happened": 3,
   "thread": "dad",
   "mins": 7
  },
  {
   "id": "charlotte",
   "label": "Charlotte's summer visit",
   "chapter": "ACT ONE",
   "as_screened": 3,
   "happened": 4,
   "thread": "charlotte",
   "mins": 9
  },
  {
   "id": "london",
   "label": "London; Harry's spare room",
   "chapter": "ACT TWO",
   "as_screened": 4,
   "happened": 5,
   "thread": "harry",
   "mins": 6
  },
  {
   "id": "noir",
   "label": "Dans le Noir; he meets Mary",
   "chapter": "ACT TWO",
   "as_screened": 5,
   "happened": 7,
   "thread": "mary",
   "mins": 9
  },
  {
   "id": "play",
   "label": "Harry's opening night, rescued",
   "chapter": "ACT TWO",
   "as_screened": 6,
   "happened": 8,
   "thread": "harry",
   "mins": 9
  },
  {
   "id": "rupert",
   "label": "Mary is already with Rupert",
   "chapter": "ACT TWO",
   "as_screened": 7,
   "happened": 9,
   "thread": "mary",
   "mins": 7
  },
  {
   "id": "party",
   "label": "Back to the night they met",
   "chapter": "ACT TWO",
   "as_screened": 8,
   "happened": 6,
   "thread": "tim",
   "mins": 10
  },
  {
   "id": "wedding",
   "label": "Dates, then the rainy wedding",
   "chapter": "ACT THREE",
   "as_screened": 9,
   "happened": 10,
   "thread": "tim",
   "mins": 12
  },
  {
   "id": "posy",
   "label": "Posy is born",
   "chapter": "ACT THREE",
   "as_screened": 10,
   "happened": 11,
   "thread": "mary",
   "mins": 5
  },
  {
   "id": "kitkat",
   "label": "Kit Kat's crash; he undoes it",
   "chapter": "ACT THREE",
   "as_screened": 11,
   "happened": 12,
   "thread": "kitkat",
   "mins": 14
  },
  {
   "id": "beach",
   "label": "Back to the beach day with Dad",
   "chapter": "ACT THREE",
   "as_screened": 12,
   "happened": 1,
   "thread": "dad",
   "mins": 12
  },
  {
   "id": "daddeath",
   "label": "Dad's illness and death",
   "chapter": "ACT THREE",
   "as_screened": 13,
   "happened": 14,
   "thread": "dad",
   "mins": 14
  },
  {
   "id": "pingpong",
   "label": "One last game with Dad",
   "chapter": "ACT THREE",
   "as_screened": 14,
   "happened": 13,
   "thread": "dad",
   "mins": 6
  }
 ]
}
